{
  "$schema": "https://json-schema.org/draft/2020-12/schema",
  "$id": "monty-pod/contracts/infer_request.schema.json",
  "title": "InferRequest — planner→pod inference task (CP-mediated; the pod polls, nothing dials in)",
  "description": "One BATCHED call per kind, never per-segment. align: the pod runs a pure wav2vec2 forward over the given windows and PUTs the emission log-softmax matrices (npz, layout in README) — post-processing stays on the planner, no text crosses. face_probe: the pod runs YuNet over sampled frames of the given shots and PUTs raw boxes (+frame_diff) as JSON (face_probe.schema.json) — decisions stay on the planner. clip_rank: the pod runs both SigLIP towers over many (intent, images) groups and PUTs cosines + L2-normalized image embeddings as JSON (clip_rank.schema.json) — the reorder, the relevance floor and the MMR dedup stay on the planner, so no threshold appears here by construction.",
  "type": "object",
  "additionalProperties": false,
  "required": ["infer_version", "job_id", "kind", "model", "put_url"],
  "properties": {
    "infer_version": { "const": 7 },
    "job_id": { "type": "string", "minLength": 1 },
    "kind": { "enum": ["align", "face_probe", "clip_rank"] },
    "model": { "type": "string", "minLength": 1 },
    "put_url": { "type": "string", "minLength": 1 },
    "weights": {
      "description": "Where the pod gets this job's checkpoint — NOTHING heavy is baked into the image. A presigned GET for a tar of the model directory, plus that tar's sha256, which is BOTH the integrity check and the pod's cache key (so a revised checkpoint can never be served from a stale cache entry). REQUIRED for align and clip_rank; forbidden on face_probe, whose 227 KB YuNet stays in the image.",
      "type": "object",
      "additionalProperties": false,
      "required": ["url", "sha256"],
      "properties": {
        "url": { "type": "string", "minLength": 1 },
        "sha256": { "type": "string", "pattern": "^[0-9a-f]{64}$" },
        "size": { "description": "Expected tar size in bytes; a mismatch fails the fetch.", "type": "integer", "minimum": 1 }
      }
    },
    "align": {
      "type": "object",
      "additionalProperties": false,
      "required": ["audio_url", "windows"],
      "properties": {
        "audio_url": { "type": "string", "minLength": 1 },
        "windows": {
          "type": "array",
          "minItems": 1,
          "items": { "$ref": "#/$defs/span" }
        },
        "keep_ids": {
          "description": "OPTIONAL column projection for the returned emissions: the sorted, de-duplicated set of vocab indices the caller's CTC forced alignment will read (its target ids plus blank). Present → the pod PUTs emissions_<i> with exactly these columns, in this order, and echoes keep_ids in the npz meta; absent → the full vocab width, byte-identical to before. It is an ALPHABET, not text: no word, no order and no count crosses with it, and nothing here decides anything — the alignment itself stays on the planner.",
          "type": "array",
          "minItems": 1,
          "uniqueItems": true,
          "items": { "type": "integer", "minimum": 0 }
        }
      }
    },
    "face_probe": {
      "type": "object",
      "additionalProperties": false,
      "required": ["video_url", "shots", "stride", "frame_diff"],
      "properties": {
        "video_url": { "type": "string", "minLength": 1 },
        "shots": {
          "type": "array",
          "minItems": 1,
          "items": { "$ref": "#/$defs/span" }
        },
        "stride": { "type": "integer", "minimum": 1 },
        "frame_diff": { "type": "boolean" }
      }
    },
    "clip_rank": {
      "description": "MANY groups per call: a montage scores many candidates across many beats, and one round trip per beat would dominate the wall clock.",
      "type": "object",
      "additionalProperties": false,
      "required": ["groups"],
      "properties": {
        "groups": {
          "type": "array",
          "minItems": 1,
          "items": {
            "type": "object",
            "additionalProperties": false,
            "required": ["intent"],
            "oneOf": [
              { "required": ["image_urls"], "not": { "required": ["origin_urls"] } },
              { "required": ["origin_urls"], "not": { "anyOf": [{ "required": ["image_urls"] }, { "required": ["image_cells"] }] } }
            ],
            "properties": {
              "intent": {
                "description": "The English meaning to score against. \"\" = embed-only: the image tower is text-independent, so the group still yields embeddings and its scores come back as -1.0.",
                "type": "string"
              },
              "image_urls": {
                "description": "Presigned GETs, fetched under the presigned-only rule. A group carries exactly one of image_urls or origin_urls.",
                "type": "array",
                "minItems": 1,
                "items": { "type": "string", "minLength": 1 }
              },
              "origin_urls": {
                "description": "Stock-provider ORIGIN thumbnail URLs the pod fetches itself (MISC-333). A group carries exactly one of image_urls or origin_urls; image_cells are not allowed with origin_urls.",
                "type": "array",
                "minItems": 1,
                "items": { "type": "string", "minLength": 1 }
              },
              "image_cells": {
                "description": "Optional crop per image_urls item: [x,y,width,height,sheet_width,sheet_height]. Only with image_urls.",
                "type": "array",
                "items": {
                  "anyOf": [
                    { "type": "null" },
                    { "type": "array", "minItems": 6, "maxItems": 6,
                      "prefixItems": [
                        { "type": "integer", "minimum": 0 },
                        { "type": "integer", "minimum": 0 },
                        { "type": "integer", "minimum": 1 },
                        { "type": "integer", "minimum": 1 },
                        { "type": "integer", "minimum": 1 },
                        { "type": "integer", "minimum": 1 }
                      ] }
                  ]
                }
              }
            }
          }
        }
      }
    }
  },
  "allOf": [
    {
      "if": { "properties": { "kind": { "const": "align" } }, "required": ["kind"] },
      "then": { "required": ["align", "weights"], "not": { "anyOf": [{ "required": ["face_probe"] }, { "required": ["clip_rank"] }] } }
    },
    {
      "if": { "properties": { "kind": { "const": "face_probe" } }, "required": ["kind"] },
      "then": { "required": ["face_probe"], "not": { "anyOf": [{ "required": ["align"] }, { "required": ["clip_rank"] }, { "required": ["weights"] }] } }
    },
    {
      "if": { "properties": { "kind": { "const": "clip_rank" } }, "required": ["kind"] },
      "then": { "required": ["clip_rank", "weights"], "not": { "anyOf": [{ "required": ["align"] }, { "required": ["face_probe"] }] } }
    }
  ],
  "$defs": {
    "span": {
      "description": "[start, end] seconds, source time, end > start (model-enforced).",
      "type": "array",
      "minItems": 2,
      "maxItems": 2,
      "items": { "type": "number", "minimum": 0 }
    }
  }
}
