{
  "infer_version": 7,
  "job_id": "job_9f2c1a",
  "kind": "clip_rank",
  "model": "google/siglip2-so400m-patch14-384",
  "put_url": "https://storage.example/o/70412.json?sig=PUT",
  "weights": {
    "url": "https://r2.example/models/siglip2-so400m-patch14-384.tar?X-Amz-Signature=deadbeef",
    "sha256": "bbbbbbbbbbbbbbbbbbbbbbbbbbbbbbbbbbbbbbbbbbbbbbbbbbbbbbbbbbbbbbbb",
    "size": 4581234567
  },
  "clip_rank": {
    "groups": [
      {
        "intent": "a falling crypto chart on a trading screen",
        "image_urls": [
          "https://storage.example/o/33901.png?sig=GET",
          "https://storage.example/o/33902.png?sig=GET",
          "https://storage.example/o/33903.png?sig=GET"
        ]
      },
      {
        "intent": "a crowded city street at night",
        "image_urls": [
          "https://storage.example/o/41180.png?sig=GET"
        ]
      },
      {
        "intent": "",
        "image_urls": [
          "https://storage.example/o/52277.png?sig=GET",
          "https://storage.example/o/52278.png?sig=GET"
        ]
      }
    ]
  }
}
